34735,779,R_3Jzv1X4edeCto6V,25/07/2020 05:38,248,R_2Bs7mGDc1DcmBPz,02/08/2020 07:48,1,4,5,28,29,5,6,6,7,18,25,43,22,28,50,3,3,6,6,50,,Female,White,1,HR5,3,noticingnature,noticingnature,2,5,5,5,5,5,1,4,6,1,"That I consciously made an effort to take time to notice my surroundings when outside - listening, looking, smelling - slowing down and just being aware of this rather than caught up in day to day planning & tasks",,1,,,,,"I did the activities, but found it an extra duty to report the results - another thing on the to do list (but this was way outweighed by enjoying the taking notice)",,1,,,,,,,4,4.606382979,52.205844,-3.0275635
58258,791,R_1OC8oXV9lms8QJG,25/07/2020 09:16,249,R_2czIzV12VMJr4aV,02/08/2020 09:24,1,5,5,27,26,6,7,6,7,16,19,35,14,20,34,5,4,7,7,59,,Female,White,1,KY11,2,butterfly,citsci,3,5,5,5,5,4,1,4,6,1,"Spotting butterflies that I'd not seen before, like Grayling & identifying Common Blue butterflies going up a munro at 650m.",1,,,1,,,Nothing.,,,,,,,1,,8,7.372856443,56.031093,-3.3990906
18330,640,R_3r09yr13lsZgM5c,23/07/2020 06:24,250,R_32YldRjTMkhKsKZ,02/08/2020 10:46,1,6,6,28,30,8,7,8,6,18,,,21,,,4,3,7,7,26,,Female,White,1,AB10,2,butterfly,citsci,3,5,2,5,5,2,4,3,6,1,"It made me go out on my own which I am sometimes anxious about and I ended up enjoying it. I was very unlucky with weather, so I didn't manage to report any butterfly sightings, but I had the pleasure to enjoy a beautiful house martin/sand martin display one of the days.",,1,,,,,"The weather was too cold and windy for butterflies to be out. Not the first time I tried to do a butterfly count, but just like last time, there weren't any butterflies around on any of the occassions. Interestingly, the day the activity ended, I saw a number of ringlets and large whites. I guess butterflies just don't really like me or have a cruel sense of humor. ",1,,,,1,,,,9,7.721661055,57.148232,-2.0966479
61720,786,R_2QlaSWcHAvlqo3L,25/07/2020 07:38,251,R_2th8NpM7LUct7qq,02/08/2020 11:20,1,3,5,28,28,7,8,7,8,16,15,31,18,15,33,3,4,7,9,69,,Female,White,1,NP23,2,butterfly,citsci,3,5,5,5,5,5,1,3,6,1,looking for butterflies,1,,,,,,not seeing any,,,,,1,,,,3,2.95766129,51.798452,-3.1752546
83497,759,R_20PqHw1z6aoXxow,24/07/2020 14:26,252,R_3O3cRmcarK90ANo,02/08/2020 11:46,1,6,6,30,29,8,8,8,8,7,25,32,7,19,26,4,5,8,8,57,,Female,White,1,EX31,2,butterfly,citsci,3,5,5,5,4,4,1,3,5,1,"Finding different places to go in my area, and noticing how species were affected by habitat and weather!",1,,,,,,The weather was resrictive on some days as butterflies dont fly in poor weather,1,,,,,,,,5,5.579127459,51.085018,-4.0825138
37189,705,R_pyOLVEO2ycjcygV,24/07/2020 01:25,256,R_29sFSEyJ5Qdhesq,02/08/2020 13:31,1,6,6,23,26,8,7,8,8,15,22,37,14,24,38,5,5,8,8,53,,Male,Mixed,1,BR1,6,acontrol,control,2,4,3,3,4,5,3,2,,,,,,,,,,,,,,,,,,,5,5.882778582,51.406271,0.015176765
14394,750,R_2YWdoTuxRwQodu3,24/07/2020 12:21,257,R_3RdRnqzNCVBmiDT,02/08/2020 13:55,1,4,4,19,24,5,3,7,6,18,15,33,19,16,35,3,2,8,3,45,,Female,White,1,CF14,1,pollinator,citsci,2,4,4,5,4,4,3,1,4,1,Taking time to sit and look,,1,,,,,"Unsure on identification, they move fast! ",,,,,,1,,,7,6.255611544,51.545957,-3.1887526
63511,804,R_9XFEz2U4Mna5IOd,25/07/2020 21:30,259,R_RUZKBk0A0rFAtwJ,02/08/2020 23:58,1,5,6,27,26,8,8,8,9,10,27,37,13,28,41,4,4,7,9,30,,Female,White,1,DT1,3,noticingnature,noticingnature,3,5,5,5,5,4,1,3,5,1,Good to focus and see what I came up with,,1,,,,,,,,,,,,,,7,6.575670498,50.715191,-2.4440823
27740,792,R_oXZcnwqlUyD7jDX,25/07/2020 10:06,260,R_1BPmSvnRGDHe869,03/08/2020 00:14,1,4,4,26,23,7,7,7,7,12,20,32,11,20,31,3,3,7,7,67,,Male,White,1,IP33,6,acontrol,control,2,4,4,4,4,4,1,4,,,,,,,,,,,,,,,,,,,7,7.246218487,52.245954,0.71145292
11114,581,R_1gGErBkuuGiPRce,23/07/2020 03:05,261,R_VVHUuidmEQPsvFT,03/08/2020 00:20,1,7,7,29,30,10,10,10,10,21,25,46,25,,,4,4,10,10,71,,Female,White,1,SA2 ,2,butterfly,citsci,2,5,5,5,5,5,1,2,6,,,,,,,,,,,,,,,,,,8,7.08125,51.617369,-3.9667531
67307,747,R_1N2mVXA0Fs1Hzay,24/07/2020 11:07,262,R_5j1iSV5yEAkWSM9,03/08/2020 00:32,1,4,4,27,26,7,6,7,5,10,,,8,,,4,4,8,7,31,,Female,White,1,FK1,2,butterfly,citsci,2,1,1,2,2,1,5,1,5,1,Learned to ID some new butterflies ,,,,1,,,Found it very frustrating as butterflies need particular conditions and whenever I had time to do the activity those conditions weren’t right. I think I would have enjoyed it more if it was something that was easier and more reliable to spot like birds. ,1,,,,1,,,,4,4.944533762,56.001996,-3.7847771
68381,780,R_1NlI6P39IhLROg0,25/07/2020 06:16,263,R_1gBz5Cvr1yMJuqF,03/08/2020 02:31,1,5,5,25,28,7,7,8,6,18,21,39,17,25,42,4,4,9,6,30,,Male,White,1,NE33,5,combinedbutterfly,combined,2,4,4,5,5,5,4,2,4,1,the motivation to contribute to a citizen science project & the enjoyment from taking time to notice nature,,,1,,,,"The frustration that there were few opportunities where the weather was ideal for butterfly counting, and the fact that there is only 1 place within easy walking distance of my house where butterflies might be found in reasonable numbers.",1,,,,,,,,1,2.341604632,54.997828,-1.4325006
50408,638,R_2fwwtys9NGn5VmL,23/07/2020 06:22,264,R_21GUd3BvBwOrIdf,03/08/2020 03:42,1,3,5,24,25,6,7,6,7,14,14,28,18,18,36,4,4,6,7,55,,Female,White,0,CH45,3,noticingnature,noticingnature,2,4,5,5,4,4,1,2,6,1,It made me more aware of nature in all aspects of the environment ( even in a layby on a busy road),1,,,,,,remembering to submit the answers each day,,1,,,,,,,4,4.174946004,53.431241,-3.0592523
78647,773,R_1Qge8hB1UjiB1wO,25/07/2020 02:42,266,R_2ziHoJrcMpjYVMf,03/08/2020 04:15,1,5,5,20,21,6,7,7,8,13,21,34,19,22,41,3,3,7,7,83,,Female,White,1,BS48,2,butterfly,citsci,2,4,3,4,4,4,2,4,5,1,Being outside and being a focussed observer,,1,,,,,Frustrated by the windy weather and the lack of butterflies in the places I looked,1,,,,1,,,,8,8.018907563,51.434836,-2.7534906
77751,810,R_33weRUWR9b56ANU,26/07/2020 03:31,267,R_33BUa45qOaraB4s,03/08/2020 04:49,1,4,4,28,26,7,7,7,9,12,21,33,11,19,30,3,3,8,8,45,,Female,White,1,CT6,2,butterfly,citsci,0,3,3,3,3,3,3,0,,,,,,,,,,,,,,,,,,,7,5.534706331,51.362132,1.1209207
55472,625,R_10PnIgygEsLPfVY,23/07/2020 05:27,268,R_2dnBoXp0z9XfLbH,03/08/2020 05:07,1,5,5,24,23,9,9,9,10,19,24,43,16,24,40,5,5,10,10,56,,Male,White,1,HU5,3,noticingnature,noticingnature,0,4,5,4,4,4,2,4,5,1,easy,,,,,,1,Finding something new,,,,,,,,,4,3.932608696,53.757286,-0.34854647
73972,550,R_12arYK1mzYMcHz8,22/07/2020 10:17,270,R_uk3Q9gMzWTtCWMF,03/08/2020 06:37,1,2,4,17,22,5,7,5,7,13,12,25,16,14,30,4,4,7,8,57,,Female,White,1,OX11,6,acontrol,control,,,,,,,,,,,,,,,,,,,,,,,,,,,9,8.370653686,51.602002,-1.2562826
79619,654,R_3nwk6Kdf1gTcXUk,23/07/2020 08:32,273,R_2v6ADhLsvbhCQSQ,03/08/2020 04:10,1,3,3,20,21,7,7,8,7,11,15,26,10,16,26,3,3,8,8,52,,Female,White,1,S17,6,acontrol,control,0,,,,,,,0,,,,,,,,,,,,,,,,,,,8,8.344383057,53.335594,-1.5466685
12369,815,R_1lsEgo7DIp8xZZx,26/07/2020 11:00,274,R_3dEPbbjq0f8wrSM,03/08/2020 11:37,1,6,6,30,30,8,10,8,10,14,19,33,19,21,40,3,4,8,9,44,,Female,White,1,PE36,1,pollinator,citsci,2,5,5,5,5,4,2,1,2,1,It made me sit and focus only on that one thing.,,1,,,,,How difficult it was to fit the 10min survey into the day.,,1,,,,,,,4,3.744245524,52.934464,0.48854848
79771,725,R_1kHwRwOw0rTq1Ci,24/07/2020 05:24,275,R_UnFmrbmvqvDyqat,03/08/2020 12:36,1,4,4,24,25,8,8,8,8,17,,,15,,,4,5,9,8,23,,Male,White,1,EH9,6,acontrol,control,0,3,3,3,3,3,3,0,,1,na,,,,,,,na,,,,,,,,,10,9.862825789,55.934593,-3.1935895
93671,812,R_2CKtrRm5MnhoqN1,26/07/2020 08:01,276,R_8uYzvo2xOQJSNRT,03/08/2020 13:02,1,2,2,15,16,6,4,2,4,7,5,12,7,,,2,2,2,3,25,,Prefer not to say,Prefer not to say,0,EH14,4,combinedpollinator,combined,2,5,1,3,4,4,5,1,5,1,it was something to do and i learned a bit about insects,,,,1,,,"i felt my performance in the task was poor, and i found the sunlight very grating",,,,,1,,,,9,7.658187599,55.929872,-3.2483283
99691,673,R_2q7VsliU4ue53tJ,23/07/2020 11:03,277,R_2xxS5KRD22LrDyj,03/08/2020 15:47,1,6,6,27,30,7,8,10,9,18,28,46,20,28,48,3,3,7,8,57,,Female,White,0,CT16 ,5,combinedbutterfly,combined,3,5,5,5,5,4,1,4,5,1,"Being outside and the delight in seeing nature (birds, butterflies and bees) and being able to take the time to watch them",1,,,,,,Feeling frustrated when it rained so I couldn’t take part ,1,,,,,,,,2,3.507526882,51.130714,1.315602
74775,803,R_1ierNRs6l24LrAO,25/07/2020 16:39,278,R_pFz60BxiizdQiwp,03/08/2020 17:26,1,4,4,29,27,8,7,7,8,18,19,37,17,20,37,3,3,8,7,42,,Male,White,0,SL6,5,combinedbutterfly,combined,2,4,5,5,5,4,3,2,5,1,Learning new butterflies and adding to records ,,,1,1,,,nothing,,,,,,,1,,9,7.974187935,51.525605,-0.70097357
55299,200,R_1EgKpGGHuRcKQg9,16/07/2020 05:33,279,R_25ZnanR49totdVm,27/07/2020 17:50,1,3,4,23,24,9,9,10,9,24,27,51,20,27,47,5,5,9,9,40,,Female,White,1,IP26,6,acontrol,control,0,,,,,,,,,,,,,,,,,,,,,,,,,,6,5.482573727,52.487999,0.52345022
56190,220,R_4TUxSZfSykpdDDX,16/07/2020 08:09,280,R_1QchjpSBldtbqdO,28/07/2020 02:48,1,7,7,30,30,4,3,5,4,25,28,53,25,28,53,4,4,3,1,49,,Male,White,1,IP24,6,acontrol,control,0,,,,,,,,,,,,,,,,,,,,,,,,,,4,4.660618997,52.41501,0.74680277
26822,830,R_3KZsvyCyRJXVXwR,27/07/2020 05:03,281,R_2PBtdih0cHE7oNp,04/08/2020 05:08,1,7,7,29,29,8,9,8,8,23,25,48,17,28,45,4,5,8,8,45,,Female,White,1,NP25 ,3,noticingnature,noticingnature,1,3,3,3,3,3,3,2,1,,,,,,,,,,,,,,,,,,6,6.229254571,51.826815,-2.7136401
42103,827,R_2aFt74CYIxTCaqU,27/07/2020 04:06,282,R_3J9Rkzkafl2JdLQ,04/08/2020 05:23,1,5,6,28,29,7,3,7,7,20,22,42,22,23,45,3,2,5,3,70,,Male,White,1,BT63,5,combinedbutterfly,combined,3,5,5,5,5,5,1,2,6,1,Counting butterflies: I'm always looking for more than one or two species,1,,,,,,If I had disliked the activities I would not have taken part,,,,,,,1,,4,4.108108108,54.3877722,-6.3529171
88307,818,R_cTrqOazSFBBodBn,26/07/2020 14:39,283,R_b1t99SmuugdQmCR,04/08/2020 06:05,1,7,5,28,30,7,8,7,8,15,21,36,19,23,42,3,4,7,7,29,,Female,White,1,LA9,5,combinedbutterfly,combined,2,4,4,4,3,3,1,2,5,1,It didn't take up much time and knowing I needed to do it made me make time for it in the day.,,1,,,,,I was asked to record butterflies which need quite favourable weather conditions so this altered slightly when I would go out rather than going out and appreciating nature in all weathers.,1,,,,,,,,6,6.799679487,54.329713,-2.7468466
60130,826,R_ctHzmAUt5etgsQp,27/07/2020 03:30,284,R_2OOvrs1q5Gko8mG,04/08/2020 06:22,1,3,2,27,27,6,5,6,5,20,22,42,21,22,43,3,3,6,5,44,,Female,White,1,NN10,6,acontrol,control,2,4,4,5,5,5,2,1,,,,,,,,,,,,,,,,,,,6,6.083548665,52.291772,-0.59744926
93243,644,R_2cnekxXhUVjT3CD,23/07/2020 06:55,285,R_1o1FDYazqYU6c9q,04/08/2020 07:14,1,4,5,30,27,9,9,8,10,11,20,31,16,23,39,4,3,9,10,47,,Female,White,1,WA7,5,combinedbutterfly,combined,3,5,5,5,5,5,1,2,5,1,being close to nature and noticing new things,1,,,,,,nothing,,,,,,,1,,2,3.535060976,53.325776,-2.6944663
65464,855,R_1pMpE4v2T4ipXhO,27/07/2020 07:17,286,R_3Giyv60p50QhEgd,04/08/2020 07:50,1,3,3,26,18,8,8,7,7,8,10,18,9,11,20,4,4,8,7,42,,Male,White,1,OX7,6,acontrol,control,0,1,1,1,1,1,1,0,,,,,,,,,,,,,,,,,,,9,8.703786192,51.866948,-1.4788924
30877,859,R_3qQkuZNhoMvwWS5,27/07/2020 08:14,287,R_2YK6rafUuH5OXX8,04/08/2020 09:02,1,7,7,26,26,8,8,8,8,7,20,27,6,19,25,3,3,8,8,56,,Female,White,0,SN3,3,noticingnature,noticingnature,3,5,5,5,5,5,1,2,6,1,Felt like I was contributing to something which is important to me.,,,1,,,,Nothing to dislike.,,,,,,,1,,7,5.351168512,51.55975,-1.7698869
77502,445,R_3hovJsPdF4hFnhw,21/07/2020 06:45,289,R_2TNS2607ryJGGl1,02/08/2020 03:38,1,6,6,28,28,6,7,5,6,9,,,9,,,4,4,9,8,72,,Female,White,1,PL12,4,combinedpollinator,combined,3,5,5,5,3,5,1,2,6,1,I felt it was important to do the FIT pollinator count because of the decline in insects due to many factors.It was nice to be in an environment surrounded by plants and insects.,1,,1,,,,Nothing,,,,,,,1,,6,5.840697674,50.410417,-4.2291854
98557,821,R_2TNqiJw6HtEB2m8,27/07/2020 01:42,290,R_ah1SijLKJECs8mZ,04/08/2020 10:07,1,3,2,16,18,7,6,7,8,10,22,32,10,21,31,5,5,7,8,48,,Female,White,1,G73,2,butterfly,citsci,1,3,3,4,4,4,5,1,2,1,Liked spending time watching,,1,,,,,Weather. Butterfly app not working on phone. Couldn’t register and see screens.,1,,,1,,,,,3,4.252945797,55.834322,-4.2030057
23285,858,R_wN7saMzFvovlnr3,27/07/2020 08:02,291,R_3qJOLzbgJ4opYcW,04/08/2020 10:26,1,6,6,24,28,7,6,7,7,21,27,48,18,24,42,3,4,6,7,58,,Female,White,1,BS32,2,butterfly,citsci,2,4,4,4,4,4,1,4,4,1,watching butterflys is fun and felt useful planting some cabbages for them,1,,,,,,the nextdoor neighbour!,,,,,,,,1,9,7.851798561,51.543734,-2.5627215
63311,856,R_pmgsl52eP8iuJjP,27/07/2020 07:40,292,R_3J44bLwQSo0sf2h,04/08/2020 11:27,1,4,4,27,25,7,7,7,8,13,27,40,7,23,30,4,4,7,8,49,,Female,White,1,BD16,4,combinedpollinator,combined,1,4,4,4,4,3,3,2,2,1,Easy to submit 3 things o noticed hit massively put off by huge detail of pollinator survey project. ,,,,,,1,Immense amount of detail to look at pollinator survey andaddirional creation of account to log in and record results which I never did  ,,,1,1,,,,,6,6.268292683,53.844834,-1.8344188
78248,828,R_28M6GBqTttJpH9k,27/07/2020 04:30,294,R_1KdVFv9WarTNstZ,04/08/2020 13:44,1,7,6,29,29,7,7,8,8,20,25,45,21,27,48,4,4,7,8,62,,Female,White,1,GU24,4,combinedpollinator,combined,3,4,3,3,3,4,3,2,5,1,Made me learn more about insects,,,,1,,,Making the frame - am disabled so it was difficult,,,1,,,,,,9,8.709759189,51.30442,-0.63868342
79873,865,R_3fxiwHHrn0MWRoH,27/07/2020 09:25,295,R_3QF7SNIUPSc0Axa,04/08/2020 14:44,1,4,5,18,20,7,8,8,8,14,24,38,13,23,36,5,4,8,8,54,,Female,White,0,BD11,5,combinedbutterfly,combined,2,4,4,4,2,2,3,2,3,1,Made me take time to notice nature. Learned to identify more butterflies.,1,,,1,,,It was difficult to come up with different things that I noticed in nature. ,,,,,,1,,,6,6.282798834,53.755942,-1.6595173
72356,879,R_3Em0iwGJOeKyykG,27/07/2020 16:13,296,R_2TSsv2UsPB5PveI,04/08/2020 16:30,1,5,4,29,27,3,4,6,7,18,15,33,20,,,2,2,2,5,58,,Female,White,1,N15,6,acontrol,control,,,,,,,,,,,,,,,,,,,,,,,,,,,3,3.037319763,51.584643,-0.092520204
12146,884,R_3Lh8L9sRyfPwBL2,27/07/2020 22:45,297,R_233n6l2o8KBmLjG,04/08/2020 23:39,1,7,7,29,29,9,9,9,9,27,21,48,24,21,45,4,4,9,10,71,,Male,White,1,SK2,3,noticingnature,noticingnature,0,3,3,3,3,3,3,3,3,1,I did noticing only ,,,,,,,None ,,,,,,,1,,5,4.513761468,53.404176,-2.1370317
83979,838,R_W749jKiTMAodRDj,27/07/2020 05:25,298,R_2CEtqWOD9QclxPy,04/08/2020 23:47,1,7,6,28,28,8,9,9,9,17,,,18,,,4,4,9,9,52,,Female,White,1,SN15,3,noticingnature,noticingnature,3,5,5,5,5,5,1,2,1,1,Taking more notice of nature than usual,1,,,,,,Nothing,,,,,,,1,,6,6.780289855,51.465667,-2.1175468
59813,849,R_3PI6PspnGswSf0z,27/07/2020 06:15,299,R_2PwlWUxmCmt8Ljd,05/08/2020 00:30,1,7,6,27,28,5,7,7,7,19,28,47,20,28,48,3,3,6,7,39,,Female,White,1,NE10,3,noticingnature,noticingnature,2,4,5,5,5,5,1,4,5,1,I liked feeling like I was making a contribution to conservation science,,,1,,,,"Nothing, it was all an enjoyable experience ",,,,,,,1,,2,2.89571899,54.955371,-1.5743373
10668,885,R_1QclzNfnDq0T3yz,28/07/2020 00:18,300,R_3LZ61qexp0aJUnE,05/08/2020 02:26,1,6,6,29,29,8,8,8,8,22,25,47,23,25,48,4,5,8,9,51,,Female,White,1,KA3,5,combinedbutterfly,combined,2,4,4,4,5,5,4,3,3,1,Looked toward to seeing what the task was.,,1,,,,,The weather meant I was not able to do the butterfly count more often.,1,,,,,,,,6,5.516344725,55.612566,-4.4964424
22146,864,R_1duWAZueH1I7hKH,27/07/2020 09:16,301,R_1l0tNCbxDSdvRzt,05/08/2020 03:14,1,4,5,28,28,8,7,8,8,21,28,49,22,28,50,3,3,7,8,43,,Female,White,1,TR11,3,noticingnature,noticingnature,2,3,3,3,4,4,4,2,4,1,I am in nature a lot anyway and notice things on a daily basis but I liked being able to write it down for something larger than my own observations.,,1,,,,,I felt that the survey doesn't sufficiently distinguish between people who are noticing nature as part of the experiment and those who do it anyway. Every one of my observations would have been made regardless of the survey so I couldn't honestly say that taking part made me feel better or more connected when I strive for this in daily life. I think this needs to be considered in the interpretation of the results as the questions asked don't really distinguish this well.,,,,,,,,1,6,5.946520147,50.157132,-5.0712664
66952,873,R_3kNaTNcmaMvpmh0,27/07/2020 15:09,302,R_1rv1V7wDY34l4cQ,05/08/2020 03:45,1,4,4,23,26,6,6,6,6,16,5,21,16,9,25,3,4,6,6,61,,Male,White,1,SW9,2,butterfly,citsci,3,4,4,4,4,4,1,2,6,1,,,,,,,,nothing,,,,,,,1,,2,2.630841121,51.471957,-0.11303446
14616,895,R_W0CrOBWsyjejZ8B,28/07/2020 03:25,303,R_3iEYkezB3E8RExd,05/08/2020 03:58,1,7,7,28,25,8,8,9,8,20,27,47,22,26,48,3,3,9,10,54,,Female,White,1,RG17,3,noticingnature,noticingnature,2,4,4,5,3,4,1,2,5,1,I enjoyed telling you what I'd seen,,,,,1,,I found that I didn't necessarily find 3 items to complete,,,,,1,,,,8,7.737186478,51.411566,-1.5171249
27027,429,R_3qvRpcLXrz9oK8W,21/07/2020 03:51,305,R_2QGMBmrAiteWwvQ,29/07/2020 04:25,1,6,5,29,28,8,8,7,8,16,19,35,15,19,34,4,4,8,8,66,,Female,White,1,DD5,6,acontrol,control,,,,,,,4,,,,,,,,,,,,,,,,,,,,9,8.344734473,56.470395,-2.8792486
67002,831,R_1F4cgRcmgY4tzSX,27/07/2020 05:01,307,R_WwkYTiu6QVys6tP,05/08/2020 04:59,1,5,5,27,27,7,8,7,8,19,19,38,17,16,33,3,3,7,7,64,,Female,White,1,SG2,6,acontrol,control,0,3,3,3,3,3,3,0,,1,No activity provided??,,,,,,,No activity provided ??,,,,,,,,,5,5.902283105,51.911026,-0.17649633
25687,868,R_2ZZZ07BOAQ2DmWF,27/07/2020 11:59,308,R_33y6w9iHyoWre4d,05/08/2020 05:20,1,3,4,22,25,7,6,6,7,10,,,11,,,4,4,8,8,38,,Female,White,1,N7,6,acontrol,control,,,,,,,,,,1,NA,,,,,,,NA,,,,,,,,,3,3.322435897,51.555344,-0.12871342
60489,189,R_2z91aTkMUhUx7qA,16/07/2020 04:00,309,R_3gMH4LBs41UuyBM,05/08/2020 06:11,1,6,6,30,30,7,6,6,7,19,24,43,20,19,39,4,4,5,6,39,,Female,White,1,NP10,3,noticingnature,noticingnature,2,5,5,5,5,1,1,2,5,1,It reminded me how rarely I sit down for even just 10 minutes to 'do nothing' and how beneficial it is to do so in nature.,,1,,,,,There was nothing I disliked.,,,,,,,1,,7,6.238356164,51.594754,-3.0523433
31978,462,R_cZ2naNwuEEbpKEx,21/07/2020 10:16,311,R_3Do1FbMK1Ja8Glu,29/07/2020 10:37,1,6,6,29,30,7,7,8,7,14,11,25,16,14,30,4,5,8,8,26,,Female,White,1,E17 ,6,acontrol,control,0,,,,,,,,,,,,,,,,,,,,,,,,,,3,3.513073134,51.585503,-0.018013658
50599,878,R_1dazt9kvcVxDyZk,27/07/2020 16:07,312,R_296q8qB9i0ms1iS,05/08/2020 12:17,1,5,5,27,27,7,7,7,7,21,24,45,23,26,49,3,3,7,7,60,,Female,White,1,BN2,4,combinedpollinator,combined,2,4,4,5,4,4,1,2,5,1,Encouraged me to just sit or stand peacefully and observantly outside,,1,,,,,"Not really a problem, but when trying to upload a photo that was too large, frustrating as I was in a hurry",,,,1,,,,,4,4.425113995,50.820705,-0.11956093
34239,914,R_3DvEr9eoUHxalNW,28/07/2020 12:52,313,R_umDPJt7KI6TfLmF,05/08/2020 13:18,1,2,3,12,21,0,3,0,3,5,15,20,11,15,26,2,1,1,3,57,,Female,White,0,PE6,3,noticingnature,noticingnature,3,5,5,5,5,5,1,1,5,1,It made me take time out to notice nature,1,,,,,,Nothing,,,,,,,1,,7,7.105351171,52.664151,-0.17050346
78033,862,R_20YCYaVWP47YBbF,27/07/2020 09:11,315,R_DDcAKBKr4IV5105,06/08/2020 02:46,1,5,6,27,26,8,9,10,10,19,20,39,19,24,43,4,4,9,9,54,,Female,White,1,SE26,4,combinedpollinator,combined,3,5,5,5,5,5,1,4,5,1,It as a reminder to go outside and enjoy nature.,1,,,,,,Not relevant,,,,,,,,,3,3.776970954,51.429773,-0.04609493
44112,928,R_3hu8bgLE0h3ElWE,29/07/2020 03:46,316,R_1jcBJFZED2ATybL,06/08/2020 03:55,1,4,4,26,26,8,7,8,7,17,19,36,12,17,29,4,3,8,7,54,,Female,White,1,WA4,2,butterfly,citsci,3,5,5,5,5,5,4,2,3,1,Learning to identify different butterflies; chance to relax outside for a time,,1,,1,,,Sometimes frustrated when bad weather or no-show butterflies interrupted the activity,1,,,,1,,,,7,6.48859127,53.384971,-2.5884424
50002,942,R_D6Rj68iNy6xnB17,29/07/2020 05:24,317,R_21dCxupiWWINSgM,06/08/2020 06:39,1,3,4,25,27,6,5,5,4,13,12,25,12,15,27,3,3,6,4,34,,Female,White,1,L36,6,acontrol,control,0,3,3,3,3,3,3,2,,1,I wasn't assigned any activity,,,,,,,I wasn't assigned any activity,,,,,,,,,2,2.760479042,53.402642,-2.8343664
41366,923,R_VOtwTlESOPHspS9,29/07/2020 02:32,319,R_1P7QdDSd1cm01CB,06/08/2020 09:09,1,3,6,29,27,7,7,7,4,15,,,18,,,3,2,6,6,33,,Female,Prefer not to say,1,,3,noticingnature,noticingnature,1,5,4,5,3,2,4,1,2,1,"taking a break to look at nature consciously, I often do it unconsciously, or while doing something else",1,,,,,,I forgot to take part many days and fill the questionnaire,,1,,,,,,,,,,
81696,930,R_2CVzbNQmzDSnymt,29/07/2020 04:11,320,R_31sUZo27e2Q8ZsL,06/08/2020 10:40,1,4,5,30,30,3,6,6,7,23,28,51,24,20,44,2,2,5,5,58,,Female,White,1,PA75,4,combinedpollinator,combined,2,5,5,5,5,5,5,2,2,1,Lovely to spend some deliberate time in the wild garden noticing insect activity and seasonal wildflowers.,1,,,,,,"The weather was consistently too wet and cold for my observations to be valid for the FIT count, although I did the activity nonetheless. In Scotland it's already moving into autumn.",1,,,,,,,,8,7.384615385,56.620599,-6.076408
39573,953,R_1kIayKpprgYIT11,29/07/2020 08:34,321,R_2f85QNZb68rG4CU,06/08/2020 10:40,1,5,5,23,25,7,8,8,8,17,23,40,18,21,39,3,3,7,8,51,,Female,White,1,BD20,3,noticingnature,noticingnature,2,4,4,5,4,3,1,4,4,1,Reflecting on the day,,1,,,,,Would have liked a more specific activity,,,,,1,,,,7,6.827806122,53.912887,-1.9357665
45854,974,R_3kj1NqnMiH7XB2R,29/07/2020 16:05,323,R_2CkOVnGgtOvXIFu,06/08/2020 16:18,1,5,3,23,24,3,3,2,3,7,11,18,7,10,17,2,2,3,3,55,,Female,White,1,BT23,3,noticingnature,noticingnature,3,5,5,5,5,5,1,2,6,1,"felt that being in the garden had broader purpose, liked really concentrating on nature",1,,,,,,nothing,,,,,,,1,,4,3.93073371,54.4947959,-5.7522704
31039,977,R_1fZe943OV4QfoOa,29/07/2020 23:37,324,R_SZCadPTlKMOeEWl,06/08/2020 23:49,1,4,4,24,25,7,8,7,7,15,9,24,20,,,4,3,8,7,24,,Female,White,1,CV5 ,6,acontrol,control,0,3,3,3,3,3,3,0,,,,,,,,,,,,,,,,,,,7,7.050847458,52.397616,-1.5346435
30954,839,R_cFH4Lqg9ekGrm7v,27/07/2020 05:28,325,R_1dsKVqOu3fNy9dC,07/08/2020 01:56,1,6,6,26,26,2,1,1,1,17,,,21,,,2,2,1,1,34,,Female,White,1,SN1,1,pollinator,citsci,2,4,5,5,4,4,2,2,4,1,"Made me leave the office, and helped me slow down and notice nature. ",1,1,,,,,"Sometimes I didn't have time, it was hard to do by myself (taking a photo, watching the whole patch, keeping an eye on the time etc), and I felt a little silly in public staring at flowers. ",,1,1,,,,,,5,5.136926438,51.565377,-1.7832322
68231,984,R_xmTrfiwJ6Wn4FIl,30/07/2020 02:25,326,R_1mVt8SO1oAbwGyD,07/08/2020 02:36,1,4,4,22,23,5,5,5,5,19,18,37,17,16,33,4,4,5,5,31,,Female,White,1,SN1,4,combinedpollinator,combined,2,3,3,4,4,3,2,2,4,1,Contributing to useful data. Improving ID skills.,,,1,1,,,One more thing to try to fit into each day!,,1,,,,,,,5,5.136926438,51.565377,-1.7832322
50766,980,R_1dmJWW5GrHKZQ4E,30/07/2020 01:08,327,R_1GBvSwbg5UmyXxw,07/08/2020 02:50,1,3,4,27,26,0,3,0,3,21,18,39,19,18,37,2,2,1,3,28,,Female,White,1,CW5,5,combinedbutterfly,combined,1,2,5,5,4,2,4,1,3,1,"The texture and colour, feeling still ",,1,,,,,Reminders and time,,1,,,,,,,6,6.469771242,53.068215,-2.5215074
20404,960,R_277EM3CoJyW5HeX,29/07/2020 10:42,328,R_2TFAdOEU3LW4lUB,07/08/2020 03:15,1,6,5,28,29,8,7,7,7,17,25,42,20,26,46,4,4,6,7,75,,Female,White,1,S11,3,noticingnature,noticingnature,3,4,3,4,3,2,2,2,4,1,making time to stop and look instead of being busy all the time,,1,,,,,"I was very disappointed that there were so few insects, birds and butterflies in my patch this year",,,,,,,,1,10,8.923004695,53.36347,-1.5085047
90961,988,R_2q2z6g5wL370hX2,30/07/2020 02:55,329,R_eEbku4fZ0n222nD,07/08/2020 03:28,1,5,6,28,28,10,9,9,9,18,25,43,21,27,48,4,4,9,10,48,,Female,White,1,YO24,3,noticingnature,noticingnature,2,5,5,5,5,5,1,3,,,,,,,,,,,,,,,,,,,7,7.03163017,53.958676,-1.0921608
61211,1001,R_27jK08Xu1G9r5s6,30/07/2020 03:53,330,R_1nNG1NZxitYPz1v,07/08/2020 05:21,1,3,4,21,22,5,3,6,3,7,,,7,,,4,2,6,4,36,,Female,White,1,W13,3,noticingnature,noticingnature,2,5,5,5,4,2,2,2,5,1,"I noticed nature rather than breezing past it, and developed a nice routine evening stroll in the park",1,,,,,,,,,,,,,,,6,5.758357211,51.528521,-0.32955688
97668,946,R_1mfHYObllhKEoq1,29/07/2020 06:55,331,R_1mfmhY8tOLOvvJ1,07/08/2020 07:13,1,7,7,29,28,7,7,8,8,25,27,52,19,27,46,3,3,7,7,62,,Female,White,1,NE16,4,combinedpollinator,combined,2,5,5,5,5,5,1,2,1,1,"being more focused, what had I noticed, interacted with?",,1,,,,,"I think I might have had to note pollinators but didn't see many, unfortunately",,,,,1,,,,7,6.662958843,54.953386,-1.6871243
53279,642,R_1LbQT0uv01ezWFg,23/07/2020 06:25,332,R_3nT0W1eubPKyP4X,31/07/2020 08:24,1,6,4,20,16,3,3,1,2,8,19,27,10,16,26,2,2,1,2,77,,Female,White,1,PO33,6,acontrol,control,,,,,,,,,,,,,,,,,,,,,,,,,,,4,4.323314379,50.722463,-1.1449696
87594,1016,R_1hSBDM6o5XxOYLO,30/07/2020 05:37,333,R_tWL9LH1in2u19gl,07/08/2020 09:03,1,7,7,30,30,6,7,4,6,23,,,26,,,4,4,5,7,69,,Female,White,1,HA2,3,noticingnature,noticingnature,3,5,5,5,5,5,1,4,6,1,Enjoyed picking three things to enter on the form. Although more than three things could have been entered ,,1,,,,,Just avoiding people.,,,,,,,,1,6,6.033477991,51.572341,-0.35059235
52150,1031,R_1Fy2QFs0wAdGSfw,30/07/2020 09:03,334,R_3n8VnH1NSduk8bn,07/08/2020 09:25,1,1,4,23,29,6,6,5,7,17,15,32,22,22,44,3,4,4,7,51,,Female,White,1,LS8 ,1,pollinator,citsci,2,5,4,5,4,4,4,2,5,1,close observation of pollinators - I learned about them and enjoyed watching them carefully,1,,,,,,"It was hard, initially, to identify the pollinators. I got better I think as the week progressed. ",,,1,,,,,,2,3.783403657,53.844399,-1.5191551
