38163661,1483,R_XgKJQZnznSOvJp7,12/08/2020 15:05,544,R_2SAHrOiWimOrzCg,20/08/2020 15:13,1,6,6,30,29,7,7,8,8,24,21,45,25,22,47,3,3,8,7,37,,Female,White,1,TA2,4,combinedpollinator,combined,3,5,5,5,5,5,4,2,3,1,Knowing I was making a difference. Noticing pollinators was therapeutic. ,1,,1,,,,Managing childcare the same time! Also the weather sometimes did not permit my doing the activities. ,1,1,,,,,,,6,5.929965557,51.025509,-3.119192
80684633,1502,R_pQReObg7cuUK1aN,13/08/2020 11:02,546,R_2aKdrUQdtYPpqjS,21/08/2020 13:22,1,5,6,28,29,8,9,10,10,14,28,42,16,28,44,4,4,8,9,31,,Female,White,1,TW12,3,noticingnature,noticingnature,3,5,5,5,5,5,1,4,5,1,Mindful and quick to record ,,1,,,,,N/A,,,,,,,,,9,8.319354839,51.432254,-0.37539439
66610662,1394,R_2OTjYtuwYABXARY,11/08/2020 02:25,547,R_2z6z7LqynM7eDOd,21/08/2020 14:15,1,4,5,22,24,6,7,7,7,10,14,24,11,12,23,3,3,7,7,47,,Female,White,1,AB13,3,noticingnature,noticingnature,2,5,4,5,4,3,1,2,6,1,"Getting outside, taking time to observe and listen to nature, explored new nature walks on my doorstep",1,,,,,,Sometimes struggled to make time to get outside,,1,,,,,,,10,9.768518519,57.100792,-2.2428303
10286116,1518,R_2VqiOJcWX4zyjul,14/08/2020 00:37,548,R_7WDDM0s8VBHcOE9,22/08/2020 02:22,1,3,2,13,14,7,7,7,8,8,14,22,13,13,26,4,4,7,7,51,,Male,White,0,SE16,6,acontrol,control,1,3,3,3,3,3,3,2,,,,,,,,,,,,,,,,,,,4,4.44011976,51.490761,-0.048285259
28142369,1515,R_2VBHQZceAXET8IE,14/08/2020 00:10,550,R_2YeM6LYdhAOKtQL,22/08/2020 02:30,1,6,6,29,30,5,4,5,7,20,22,42,25,27,52,3,3,6,5,86,,Male,White,1,CV21,5,combinedbutterfly,combined,2,3,3,3,4,4,4,2,4,1,Whatever I did I hope it will add to a knowledge base,,,1,,,,,,,,,,,,,6,5.652087475,52.379812,-1.2504282
53867711,1498,R_3dGI5hbBJZsEi1O,13/08/2020 10:00,551,R_3h5XExnOB0n7odc,22/08/2020 03:17,1,5,6,29,29,6,7,7,7,12,19,31,14,19,33,3,3,4,7,51,,Female,White,1,SE16,5,combinedbutterfly,combined,2,5,5,5,5,4,3,4,2,1,Being reminded to be mindful. Feeling of calm and happiness it gave me,,1,,,,,I felt guilty on the days when I didn't manage to do the activities ,,1,,,,,,,4,4.44011976,51.490761,-0.048285259
18464782,1523,R_1jeWqNroMNaxaLA,14/08/2020 03:40,552,R_W6wmX2YplgPweSR,22/08/2020 04:19,1,5,6,27,25,6,7,6,7,13,25,38,14,26,40,2,2,6,7,49,,Female,White,1,SN1,3,noticingnature,noticingnature,2,4,4,4,4,3,2,1,3,1,Time to stop and think.,,1,,,,,Only having a small yard to do it in.,,,,,1,,,,5,5.136926438,51.565377,-1.7832322
79775380,1528,R_1mf2QaDoI7GWYyY,14/08/2020 06:04,553,R_22ym2XgfpZ6x98a,22/08/2020 06:40,1,4,5,25,24,8,8,8,8,20,19,39,20,16,36,4,4,9,8,39,,Female,White,1,CF83,3,noticingnature,noticingnature,2,4,4,4,3,3,1,2,5,1,I enjoy noticing nature and regularly participate in citizen science projects so I felt like my normal happy everday self taking part,1,,,,,,"It has been very wet and windy in the last week, like some of the wildlife I wasn't enjoying being out in heavy rain",1,,,,,,,,4,4.309491059,51.574416,-3.2211698
27617023,1527,R_3Jeztmb19FifRRI,14/08/2020 05:26,554,R_6Li8rhgrvq5alFL,22/08/2020 07:47,1,6,6,27,28,8,8,9,9,21,15,36,17,15,32,5,5,8,9,55,,Female,White,1,CV32,4,combinedpollinator,combined,3,5,5,5,5,5,1,1,5,1,An excuse to be outside watching nature. I noticed more species than I realised were pollinating the flowers. ,1,,,,,,I didn't like missing the activity when it was pouring with rain,1,,,,,,,,7,7.337692308,52.287062,-1.5344093
15082675,1493,R_3Grm0iSZwre6zkA,13/08/2020 05:03,555,R_2sXbN2so52znbiq,22/08/2020 09:02,1,5,5,30,30,6,7,6,7,17,20,37,22,23,45,3,3,6,7,72,,Female,White,1,NG4,5,combinedbutterfly,combined,3,5,5,5,5,5,1,4,6,1,"I felt motivated to go out - particularly up to the local woods and meadow, even in less than clement weather! Noticed things a lot more. Feel healthier, too.",,1,,,,,"Sometimes difficult to only log 3 'likes' - could have written a book, ha ha! Butterfly count frustrating, as limited by timing, weather, and availabity of appropriate food - my garden was better than the meadow, but that didn't get me 'out' in the same way. ",1,1,,,,1,,,6,5.844368014,52.961055,-1.0958166
98359673,1508,R_vNvdW028e1L7EnD,13/08/2020 15:09,556,R_3EzrKD0VlJ5Ts1U,22/08/2020 10:50,1,6,6,29,30,9,9,9,9,24,28,52,24,28,52,3,4,8,8,45,,Female,White,1,WV7,3,noticingnature,noticingnature,3,5,5,5,5,5,1,4,6,1,I liked going out and looking at what was around me and noticing maybe more than I usually would.,1,,,,,,There was nothing to dislike,,,,,,,1,,8,8.235294118,52.642739,-2.2812253
48463300,1532,R_3enyXkBCHfT8R6h,14/08/2020 15:13,558,R_pGbfrkrzN50SZJD,22/08/2020 15:38,1,2,2,22,22,7,7,7,7,13,20,33,14,19,33,3,3,7,7,40,,Female,White,1,BS9,6,acontrol,control,,,,,,,,,,,,,,,,,,,,,,,,,,,9,8.570219966,51.494068,-2.6191367
52462782,1496,R_1MXPYsxulKvBH3u,13/08/2020 07:52,559,R_tRoWTWoKevLkRUt,23/08/2020 01:04,1,6,6,28,29,6,7,6,7,18,24,42,22,27,49,3,4,7,6,82,,Female,White,1,OL3,6,acontrol,control,0,,,,,,,,,1,You didn’t ask me to do anything,,,,,,,See previous answer ,,,,,,,,,8,8.229281768,53.556195,-2.0133209
24772955,1535,R_3nSDWX5XMhBzpH3,15/08/2020 03:15,560,R_1IK1OTOeBjG5dE7,23/08/2020 05:32,1,6,7,29,29,9,9,8,10,25,25,50,25,27,52,4,5,9,10,62,,Female,White,1,FK10,3,noticingnature,noticingnature,3,5,5,5,5,5,1,2,6,1,"I live in a unique, rural location but seldom get to spend as much time here as the Pandemic has allowed. It has given me an insight to who I am and the natural world that I share my everyday life with, this has made me appreciate it more. I share my nature experiences with my long distance grandchildren who live abroad but I seldom link my emotions or passions to this. Thank you, this had taught me much about myself. It has made a difference being mindful about how nature matters to me. ",,1,,,1,,"Nothing, I enjoyed everything. The only thing that concerned me was that my experiences seem unbelievable or extraordinary as I live in an unique location with nature surrounding me.",,,,,,,1,,4,4.119705341,56.117082,-3.7940923
10357529,1536,R_eL4DNtjJofd16ZH,15/08/2020 04:42,561,R_3NvK6ukzI3we4vP,23/08/2020 06:34,1,3,4,21,23,7,6,7,6,19,25,44,21,22,43,4,4,6,5,38,,Male,White,1,DE56,4,combinedpollinator,combined,3,4,4,4,5,5,1,2,4,1,Taking a closer look at the pollinating insects,1,,,,,,I found it very hard to differentiate the insects,,,1,,,,,,7,7.230511316,53.007772,-1.4291243
54252231,1509,R_ZjBkEpoJbVKiqn7,13/08/2020 15:18,562,R_D69hLQOik2NrQI1,23/08/2020 10:05,1,6,5,28,28,9,8,9,9,23,28,51,23,28,51,5,5,10,10,53,,Female,White,1,SO22,1,pollinator,citsci,3,5,5,5,5,5,1,3,5,1,"Knowing my observations are actual research data, and learning more about the pollinators that visit my flowers.",,,1,1,,,Not managing to find the time to complete the task more than the minimum amount of five times.,,1,,,,,,,9,8.196933962,51.055669,-1.325405
85493226,1503,R_2QuE7a32XfBZPay,13/08/2020 12:21,563,R_27CFm0mYRSku2cw,23/08/2020 10:25,1,3,5,22,21,5,8,5,9,12,23,35,9,23,32,4,4,5,9,66,,Female,White,1,CV4,5,combinedbutterfly,combined,3,5,5,5,5,4,3,2,6,1,Made me more focussed on my surroundings. Identifying butterflies using the guide provided.,,1,,1,,,Using the app was frustrating to begin with. The weather wasn’t very good for butterflies.,1,,,1,,,,,5,4.845984598,52.433864,-1.493136
15792576,1539,R_2B9vkBwEObSQS5U,15/08/2020 12:03,565,R_3NXw4TPEchgcpaB,23/08/2020 15:35,1,7,7,30,28,10,10,9,9,23,28,51,25,28,53,4,4,10,10,69,,Female,White,1,CV23,1,pollinator,citsci,3,5,5,5,5,5,1,3,1,1,,,,,,,,nothing,,,,,,,1,,7,7.123364486,52.410993,-1.238271
40661392,1513,R_2ara2BelipzZn06,13/08/2020 16:29,566,R_3fQc5jeg9juqrNq,24/08/2020 00:52,1,7,3,8,21,3,6,6,6,5,5,10,7,15,22,3,3,4,6,41,,Female,White,0,B14,3,noticingnature,noticingnature,2,5,5,5,5,2,1,2,6,1,"Being mindful about my surroundings whilst outside, very relaxing and enjoyable",,1,,,,,Nothing,,,,,,,1,,3,3.400774443,52.421538,-1.8888184
14949292,1478,R_3JknsSpu5jJcSfP,12/08/2020 09:48,567,R_2zwFUbiBy2Et90y,24/08/2020 08:19,1,5,5,26,25,3,4,3,5,13,23,36,17,20,37,4,4,5,5,55,,Female,White,1,SN4,1,pollinator,citsci,2,4,4,4,4,5,1,2,2,1,Got me away from my desk without feeling guilty.  Really interesting trying to identify the pollinators and seeing how many different sosrts of insects there were. I then went to look at the bee records site and I didn't realise how many species of Bee there are.,,1,,1,,,there wasn't anything that I didn't like. Trying to take photos of the insects was frustrating  - that will come with practice.,,,,,1,,1,,9,8.181120491,51.557948,-1.7077985
85019594,1545,R_2zwk7XgHekm4ft3,16/08/2020 11:54,568,R_2fDIUyGle4Zubmx,24/08/2020 12:25,1,6,5,30,30,6,5,6,6,22,23,45,24,22,46,1,1,5,5,43,,Female,White,1,HX2,2,butterfly,citsci,1,1,2,5,1,1,5,2,6,1,Liked being outside in nature,,1,,,,,Bad weather and the butterflies were impossible to photo to identify as they never stayed still.,1,,,,1,,,,4,4.225460123,53.722585,-1.8958808
21080099,1546,R_3egzKAgRDQKaDSe,16/08/2020 13:28,569,R_2qldeB3PUgSh6P6,24/08/2020 14:36,1,2,2,17,23,4,5,6,7,14,7,21,14,5,19,2,3,3,4,72,,Female,White,1,LS17,1,pollinator,citsci,2,4,4,5,4,4,1,2,4,1,It made me go outside and observe,,1,,,,,It rained a lot.,1,,,,,,,,8,7.286685552,53.94435,-1.5807752
47199149,1542,R_2anUhN8uAWzIXu3,16/08/2020 05:26,571,R_2toiQX4Jkplc5eg,25/08/2020 03:53,1,4,5,26,28,9,9,10,10,10,16,26,16,20,36,5,5,9,5,44,,Female,White,1,DE6,4,combinedpollinator,combined,2,5,5,5,5,5,4,3,2,1,"Being outside and really noticing nature, felt calmer",1,1,,,,,Frustrated about not counting the pollinators due to a week of rain and low temperatures,1,,,,,,,,8,7.823613087,53.014896,-1.735028
91352048,1551,R_27EcSqM6NIpraON,17/08/2020 04:20,572,R_2TyFlFde8VXzzd1,25/08/2020 06:22,1,4,4,26,25,7,7,7,8,10,16,26,12,,,4,5,7,9,58,,Female,White,1,HD9,6,acontrol,control,0,3,3,3,3,3,2,0,,1,,,,,,,,N/A,,,,,,,,,8,7.750347705,53.570907,-1.7857032
12438014,1549,R_2CyzE6crsStQPom,17/08/2020 03:49,573,R_1FfiQQX8s38UmiU,25/08/2020 06:21,1,4,4,27,26,2,2,2,2,15,,,18,,,3,3,3,3,51,,Male,White,0,EX4,3,noticingnature,noticingnature,2,4,5,4,4,3,1,1,5,1,LIked to think was contributing in some way. Plus the incentive to make sure carried out the activities: realising how hard it is to break away from work and get outdoors even for 10 mins otherwise,,,1,,,,The weather (rain) inhibited taking part. Sometimes self-consciousness as to what other people might have thought I was doing ,1,,,,,1,,,5,5.451442308,50.76182,-3.4914823
88097278,1557,R_8xfNHSp9ej1i1SV,17/08/2020 08:56,574,R_cTs9oqeQ7ule6D7,25/08/2020 09:17,1,3,5,27,27,8,9,8,8,13,12,25,13,16,29,4,4,8,9,45,,Female,White,1,WA7,3,noticingnature,noticingnature,3,5,5,5,4,3,1,4,6,1,I enjoyed making myself make the effort to go outside regulary.,,1,,,,,The poor weather made in difficult to go out,1,,,,,,,,2,3.535060976,53.325776,-2.6944663
54652978,1414,R_3MlMSSBo2LMcafB,11/08/2020 03:10,576,R_R8Mmf4KJrLAFh3r,25/08/2020 09:54,1,4,5,26,26,8,7,7,9,14,20,34,19,19,38,5,4,8,8,64,,Female,White,1,NG12,6,acontrol,control,,3,3,3,3,3,3,0,,,,,,,,,,,,,,,,,,,9,8.530044843,52.949299,-1.0398914
71831168,1547,R_3r0xhYtOKzyMQTr,17/08/2020 01:32,577,R_1HplHbtNDnrZLDU,25/08/2020 13:21,1,5,5,28,29,7,9,7,9,11,23,34,16,22,38,3,4,7,9,41,,Female,White,1,SN25,2,butterfly,citsci,2,5,4,5,5,5,2,4,4,1,being outside. Spotting different species of butterfly,1,1,,,,,too windy to do activity most days this week. ,1,,,,,,,,8,7.391684902,51.595237,-1.8267167
95004099,1565,R_ZskNBiY2nOhHGDv,17/08/2020 11:55,578,R_2Bf9B6VVXsaggDc,25/08/2020 13:49,1,3,3,23,26,8,7,8,7,17,26,43,18,27,45,3,3,8,9,43,,Female,White,1,HA5,2,butterfly,citsci,2,3,4,4,3,2,2,1,3,1,Spotting butterflies,1,,,,,,Lack of butterflies ,,,,,1,,,,10,8.949380722,51.592949,-0.38407581
29534823,1460,R_28FDEGht24T46do,11/08/2020 11:01,579,R_w0QB0pf4CdF9UuB,25/08/2020 15:57,1,4,4,25,23,8,7,6,6,14,10,24,9,7,16,3,3,7,8,42,,Female,White,1,OX10,6,acontrol,control,,,,,,,,,,,,,,,,,,,,,,,,,,,9,8.6981402,51.600443,-1.1228842
56362131,1512,R_pQagMJGfavn05MJ,13/08/2020 16:02,580,R_3nvdL9lUcUU7wkn,26/08/2020 03:03,1,3,3,19,16,6,5,4,5,18,12,30,14,14,28,3,3,8,6,29,,Female,White,1,B13,6,acontrol,control,0,3,3,3,3,3,3,0,,1,none - no activity given,,,,,,,not being given an activity,,,,,,,,,4,4.006487488,52.431744,-1.8822036
95150563,1466,R_1H2AhXug3Fv4wro,12/08/2020 02:03,582,R_2t6f19dK05fP7sj,26/08/2020 03:42,1,3,3,27,27,7,7,7,7,12,16,28,12,16,28,4,5,7,8,36,,Female,White,1,OX5,4,combinedpollinator,combined,2,5,5,5,5,4,2,3,3,1,I enjoyed learning more about the insects in our garden - now I can spot the hoverflies and different bees (although I still can't tell the difference between a solitary bee and a honey bee if their pollen basket is empty!),,,,1,,,"It was frustrating that the weather wasn't ideal during the week. 4 of the days I couldn't take part because it rained solidly, and I wasn't sure if I should do the noticing nature bit if I couldn't do the fiit count. There was also a lot of reading to do first - I missed the first day because I wasn't confident I'd read everything yet. ",1,,1,,,,,,9,8.285828025,51.822307,-1.2897612
65390421,1579,R_T6MSXB7ohh8NlgB,18/08/2020 03:53,584,R_ABx4Fvu6FGAiP3X,26/08/2020 05:43,1,3,5,26,29,7,8,7,8,17,19,36,18,21,39,4,5,8,9,66,,Male,White,1,DE22,4,combinedpollinator,combined,2,4,4,5,4,4,2,1,3,1,Being in the fresh air and warm sun,,1,,,,,Finding time to do the task (not a major problem),,1,,,,,,,5,5.766723842,52.930851,-1.4842583
78148542,1525,R_cwJphoS7DrvcGXf,14/08/2020 04:37,585,R_11ZquXkPAzoF3kE,26/08/2020 09:33,1,4,4,24,26,8,8,7,8,17,14,31,20,14,34,4,4,9,9,32,,Female,White,1,OX28,6,acontrol,control,,,,,,,,,,,,,,,,,,,,,,,,,,,9,8.495971352,51.790653,-1.4635186
10931251,1588,R_3npEednB6SgsDS2,18/08/2020 07:13,586,R_22AhT9JoQwD8jzZ,26/08/2020 08:08,1,5,4,28,22,5,4,7,9,21,28,49,18,15,33,3,3,5,4,75,,Female,White,1,BA11,1,pollinator,citsci,3,4,4,4,4,3,1,2,4,1,We found the result unexpected and therefore very interesting.,,,,,,1,Being concerned about accuracy of numbers and correct identification,,,1,,,,,,6,5.728429986,51.231636,-2.3211975
28399670,1592,R_2zPm10JtqUK3kbT,18/08/2020 11:56,587,R_31beVa41SELoE20,26/08/2020 12:10,1,7,6,30,28,8,8,9,8,24,28,52,22,27,49,4,4,9,10,69,,Female,White,1,NN6 ,6,acontrol,control,,,,,,,,,,,,,,,,,,,,,,,,,,,8,7.304878049,52.288248,-0.83759649
35399,882,R_6QoF3KXRU9EeNWN,27/07/2020 16:53,588,R_SV0KEousddZkq53,26/08/2020 13:21,1,4,5,29,28,1,3,4,5,16,21,37,16,19,35,2,3,1,4,50,,Male,Mixed,1,BS5,2,butterfly,citsci,3,4,4,5,5,5,4,2,5,1,I like the idea of building knowledge with personal records. I liked to see my bug friendly garden as an outpost of nature amongst the concrete and lawns.,1,,1,,,,"The irecord app is hopeless. Frustrated that sightings cannot be checked against pocture database, nor able to delete mis-sightings wasting peoples time with my amateurism....",,1,,1,,,,,3,2.965223097,51.456158,-2.5680481
31724668,1593,R_0rLOUvw6wBYxepj,18/08/2020 12:06,591,R_1JW5J29YMPuUeEM,26/08/2020 14:48,1,5,4,30,29,5,7,8,9,19,23,42,18,25,43,3,3,7,7,43,,Female,White,1,NG2,2,butterfly,citsci,2,4,4,5,4,4,4,2,4,1,Taking time to focus on nature,1,,,,,,Frustrated by work and weather limiting participation ,1,1,,,,,,,4,5.563654518,52.947965,-1.1517667
91827734,1591,R_QhnopiD0rfnwlAl,18/08/2020 11:39,592,R_2EuTnO3r3HcoU7s,26/08/2020 15:27,1,4,4,20,24,9,8,9,8,15,24,39,13,20,33,3,3,9,9,70,,Male,White,1,CH45,3,noticingnature,noticingnature,3,4,4,5,4,2,4,2,4,1,watching the world around me,,1,,,,,trying to find at least 3 different matters to report,,,,,,1,,,4,4.174946004,53.431241,-3.0592523
50671812,1606,R_2tFG9FzYt1qfa5G,18/08/2020 23:52,593,R_3iCK3paNHy20FX4,27/08/2020 01:21,1,5,5,29,30,6,6,4,6,26,27,53,21,28,49,2,2,4,7,62,,Female,White,1,CB8,6,acontrol,control,0,1,1,1,1,1,1,0,,,,,,,,,,,,,,,,,,,7,6.754901961,52.247555,0.40135185
32717405,1600,R_24ds8JhXu58sHMg,18/08/2020 14:53,594,R_2EpgGM9cqFOu9le,27/08/2020 03:24,1,4,4,29,28,7,7,8,6,19,20,39,16,25,41,3,3,7,7,70,,Female,White,1,HX7,5,combinedbutterfly,combined,3,5,5,5,5,4,1,2,5,1,It felt conscious of & connecting with nature,1,,,,,,Nothing,,,,,,,1,,6,5.571428571,53.733361,-1.9893821
16273461,1610,R_1qgruWrwNmHlSwj,19/08/2020 03:05,595,R_3sj2JtKHRhurMQq,27/08/2020 03:56,1,4,4,24,27,6,6,8,9,10,28,38,14,28,42,3,4,8,9,55,,Female,White,1,TA12,2,butterfly,citsci,0,1,1,1,1,1,5,1,4,1,"Nothing, butterflies need warm wind free weather. The past week is been very wet and windy ",,,,,,,"It was a very seasonal activity. What happens in winter, spring?",,,,,,,,1,8,7.325,50.978063,-2.7703149
48815302,1612,R_2f7qYYCeE06iP6P,19/08/2020 04:43,596,R_3g7TTGytzhSju8R,27/08/2020 05:20,1,7,6,28,27,6,7,7,10,22,28,50,21,28,49,4,5,6,5,56,,Female,White,1,,6,acontrol,control,,,,,,,,3,,,,,,,,,,,,,,,,,,,,,,
72460,317,R_2PigoG7bpmKoCFC,18/07/2020 04:56,597,R_55Xp9M2eXeZx1M5,27/08/2020 08:26,1,3,4,18,21,7,7,7,7,13,8,21,14,9,23,3,3,7,7,53,,Male,White,1,SP4,5,combinedbutterfly,combined,2,3,4,4,4,4,2,3,1,1,Simple engagement,,,,,,1,Nil,,,,,,,1,,8,7.530774801,51.148904,-1.7107298
42114798,1576,R_p9KstJ3R5FiZwJP,18/08/2020 03:36,599,R_1rf4wsW6TphvmwF,27/08/2020 09:10,1,5,6,28,27,5,6,5,6,21,21,42,20,19,39,4,5,5,5,71,,Male,White,1,OL3,2,butterfly,citsci,2,5,2,3,4,2,1,1,5,1,"I am a recorder with Butterfly Conservation anyway, so doing more of this was good.",,1,,,,,"There were hardly any butterflies on the wing here in the Pennines during this period, as it was wet and windy. As a result there were several occasions when I didn't see any at all. The iRecord app is not easy to use and will not let you submit a nil return. ",1,,,1,1,,,,8,8.229281768,53.556195,-2.0133209
38152104,1590,R_1OC5kmdhTjKkxAF,18/08/2020 10:34,600,R_1GQweuaS6WKsUwh,27/08/2020 10:34,1,4,5,22,24,7,8,8,9,12,26,38,15,25,40,4,5,8,9,51,,Female,White,1,SR4,5,combinedbutterfly,combined,3,5,5,5,5,4,1,4,6,1,"It made me more aware of my surroundings - I noticed so many more butterflies (and different varieties), by having a focus, as I walked and explored. ",1,1,,,,,When work and weather effected my ability to particiapte. ,1,1,,,,,,,2,2.904166667,54.908179,-1.4246844
90301457,1620,R_2Wu6En7WeVDFsDr,19/08/2020 10:27,601,R_2WGMsUa7ziwr7Pp,27/08/2020 13:56,1,5,5,22,23,5,6,5,6,7,13,20,11,16,27,2,2,6,5,82,,Female,White,1,ME18,3,noticingnature,noticingnature,2,5,4,5,3,3,1,2,5,1,Taking time out in the garden. Looking at nature more closely.,1,1,,,,,difficult to remember to do it. Did not like the unsettled weather on some days,1,1,,,,,,,6,6.821882952,51.266213,0.37803245
89161437,1626,R_2wmnkhVSHSIYHiy,19/08/2020 16:25,602,R_2uQUg2CAr2EXY82,27/08/2020 19:01,1,5,5,27,27,7,7,6,8,10,24,34,13,28,41,4,4,7,8,51,over 50,Female,White,1,BR5,5,combinedbutterfly,combined,3,5,5,5,5,5,1,2,6,1,It was good to formalise wha I had experienced and noticed ,,1,,,,,N/A,,,,,,,,,5,5.525267994,51.38637,0.064749625
53315554,1630,R_3PXB9TE4TRmEk4L,20/08/2020 04:47,603,R_sXzBSmLe2ItTFzX,28/08/2020 07:04,1,3,4,24,26,7,7,7,8,17,19,36,20,22,42,4,4,7,7,71,,Male,White,1,CV6,2,butterfly,citsci,3,5,5,5,4,4,1,2,4,1,I enjoyed looking for and identifying butterflies,1,,,,,,The weather prevented me from taking part on some days.,1,,,,,,,,3,3.538919187,52.416887,-1.5267951
45978842,1613,R_3qTCjtt0KbhFacy,19/08/2020 05:52,606,R_296ufK6ivu6JtRa,29/08/2020 06:02,1,2,4,25,28,2,2,2,2,15,,,22,,,1,1,2,3,49,,Female,White,1,TA18,6,acontrol,control,,,,,,,,,,,,,,,,,,,,,,,,,,,5,5.46183953,50.885324,-2.7944155
94000171,1601,R_3MKUI3uA0C8qD2i,18/08/2020 15:00,607,R_oYUUTLV5X1U7GXn,29/08/2020 08:23,1,5,6,26,28,7,7,7,7,21,21,42,23,23,46,3,3,7,7,68,,Female,White,1,CO5,3,noticingnature,noticingnature,2,4,5,5,5,4,1,2,4,,,,,,,,,,,,,,,,,,9,7.671452703,51.810128,0.75333819
38909971,1644,R_PziUgDrbIPBKV6p,21/08/2020 09:15,608,R_2Ck84iGTwaGdiTN,29/08/2020 10:18,1,5,5,27,30,6,8,6,6,13,22,35,13,23,36,4,5,6,8,59,,Female,White,1,OX7,5,combinedbutterfly,combined,2,5,4,5,4,4,1,1,4,1,I enjoy observing butterflies and having an excuse to focus just on that task,1,,,,,,At first the app confused me,,,,,,,,,9,8.703786192,51.866948,-1.4788924
86036829,1640,R_0jpi32RFnRvIpk5,21/08/2020 02:40,611,R_2zp9xoXjlVM3HlX,30/08/2020 03:37,1,4,5,22,21,7,7,5,5,13,23,36,12,23,35,2,2,6,5,57,,Female,White,1,BB12,6,acontrol,control,0,,,,,,,,,,,,,,,,,,,,,,,,,,3,4.286192469,53.79376,-2.2461869
90756665,1648,R_rcoNMBMLOBZb5Hr,21/08/2020 15:54,612,R_1gC8gSZZdH8P5T9,30/08/2020 05:51,1,7,7,28,26,9,9,9,9,23,28,51,23,25,48,5,5,10,9,48,,Male,White,1,TN14,6,acontrol,control,0,3,3,3,3,3,3,0,,1,N/a,,,,,,,N/a,,,,,,,,,8,7.855878635,51.289188,0.2030782
30222479,1656,R_ZrWLHFHXZhnP6AF,22/08/2020 02:31,613,R_1Ckk8E1nLFeNPnH,30/08/2020 06:18,1,3,4,22,22,4,7,6,7,18,19,37,19,22,41,2,2,4,5,55,,Female,White,1,TR7 ,3,noticingnature,noticingnature,1,5,5,5,5,5,1,3,6,1,Making myself remember to do things I feel worthwhile ,,1,,,,,None,,,,,,,,,3,3.551881414,50.413597,-5.0872982
35552494,1653,R_OIJildR5sZW67oR,22/08/2020 02:06,615,R_2f0taZltH8faxd4,31/08/2020 10:42,1,4,5,24,27,7,7,5,6,14,,,14,,,4,3,7,8,30,,Female,White,1,TA1,2,butterfly,citsci,2,5,4,5,5,5,1,3,1,,,,,,,,,,,,,,,,,,6,5.718365062,51.023451,-3.1097032
69053297,1657,R_2zcP87aSHo7gzqL,22/08/2020 03:01,616,R_1qevp3yWjXmxvRV,01/09/2020 02:03,1,4,5,23,20,8,9,9,9,10,14,24,8,16,24,3,2,9,9,50,,Female,White,1,TS25,2,butterfly,citsci,2,3,4,4,4,4,1,2,4,1,encouraging me to go out,,1,,,,,weather was poor so made it difficult,1,,,,,,,,2,3.132628153,54.66591,-1.1891945
86429098,1676,R_RKzqIFqAMmU7UNH,24/08/2020 03:35,618,R_3p4HnJ2HR35QlPy,01/09/2020 03:54,1,4,5,26,27,9,9,8,10,19,23,42,20,25,45,3,3,8,8,58,,Female,White,1,PE6,5,combinedbutterfly,combined,2,5,4,5,5,5,2,2,4,1,A reason to be outside,,1,,,,,Being stopped by stormy weather,1,,,,,,,,7,7.105351171,52.664151,-0.17050346
99863910,1674,R_8uYp1WY6551jNYd,24/08/2020 03:01,619,R_1omYpAboHqjPXnO,01/09/2020 04:26,1,5,4,25,27,7,7,7,8,11,17,28,14,17,31,4,5,8,8,34,,Female,White,1,SG6,6,acontrol,control,,,,,,,,,,,,,,,,,,,,,,,,,,,6,6.462696783,51.988348,-0.21945225
47071925,1666,R_3EEfQbPKjOo71eb,23/08/2020 13:18,620,R_3EG6DMg8Ou7r0uY,01/09/2020 06:27,1,2,6,28,29,5,7,7,7,16,28,44,18,28,46,3,3,8,7,0,,Female,Mixed,1,SW15,3,noticingnature,noticingnature,3,5,5,5,5,5,1,4,6,1,"making usre i went outdoors and stepped away from my computer and paperwork daily activities which had taken prededance overmy time outdoors. as i don't have a laptop i'm toed to my desktop which i feel is unhealthy. so it felt good tohave a bit more balance. i love spending some time outdoors, realised its a neccessity not a luxury",,1,,,,,"sometimes i had so much pc work, felt like if i took the time outdoors for this study was adding to my task backlog which i'm trying to clear before i'm back working 5 -6 days a week. so did feel conflicted at times",,1,,,,,,,8,6.948364008,51.464133,-0.22292897
53965508,1668,R_24eBaclwfAfrFsJ,23/08/2020 14:13,621,R_33xKNVvcmupJHOf,01/09/2020 08:03,1,4,4,25,22,6,6,6,6,13,17,30,14,20,34,3,4,6,6,56,,Female,White,1,SW15,3,noticingnature,noticingnature,2,4,3,4,4,4,1,4,5,1,Feeling that I was contributing to something worthwhile and having an excuse to gaze into space!,,1,1,,,,Nothing.,,,,,,,1,,8,6.948364008,51.464133,-0.22292897
96519300,1679,R_5o36w6Q7nnYO3MR,24/08/2020 11:42,624,R_3jUxQsgmAfnhbHh,01/09/2020 15:04,1,5,5,28,28,4,7,7,8,17,24,41,20,25,45,3,3,4,7,80,,Female,White,1,KT22,3,noticingnature,noticingnature,3,5,5,5,4,4,1,2,5,1,I loved watching creatures.,1,,,,,,Nothing,,,,,,,1,,9,8.041432584,51.30148,-0.34096798
26858018,1683,R_2ANzSjONkWuqdXi,24/08/2020 14:59,625,R_dhXGXxyLCAHUco1,01/09/2020 16:31,1,6,3,27,27,2,7,3,6,13,25,38,13,28,41,3,2,4,8,57,,Female,White,1,NR15 ,6,acontrol,control,0,3,3,3,3,3,3,0,,1,-,,,,,,,N/a,,,,,,,,,7,6.934971098,52.560428,1.405689
90440451,1682,R_1Iu6VSfM3OgsoXH,24/08/2020 14:17,626,R_2PorDvYxKKWviga,01/09/2020 23:23,1,2,2,17,20,4,6,4,7,10,10,20,11,16,27,2,2,4,7,37,,Female,Mixed,0,SS2,2,butterfly,citsci,2,4,4,4,4,4,2,1,5,1,"Time allocated for myself, noticing the butterflies",1,1,,,,,Could not complete when it was raining ,1,,,,,,,,3,3.365731463,51.547412,0.72349252
52043886,1692,R_UT826dey7vIqkdH,25/08/2020 05:34,628,R_1rNAYnOAY9PB2A7,02/09/2020 05:40,1,3,3,22,24,6,8,8,9,15,17,32,15,14,29,2,2,8,8,33,,Female,White,1,HU4,2,butterfly,citsci,0,3,3,5,2,3,4,1,1,1,Being more aware of the nature around me,1,,,,,,"Feeling under pressure to get the tasks done, also it was unhelpful that I couldn't enter information retrospectively onto the app",,1,,1,,,,,3,4.063339731,53.7455,-0.39887013
42416309,1689,R_1Ketm9e0blw7TZ4,25/08/2020 04:50,629,R_3g62ox1Yh5Xpe8V,02/09/2020 15:28,1,5,5,30,30,3,5,4,5,24,25,49,22,26,48,2,2,3,5,52,,Male,White,1,BN2 ,1,pollinator,citsci,3,5,5,5,5,5,1,2,5,1,It was fun and it was good to feel connected with nature ,1,,,,,,Nothing ,,,,,,,1,,4,4.425113995,50.820705,-0.11956093
46522676,1667,R_1jczHlGHHvtXWyy,23/08/2020 13:36,630,R_3JgAD3GhNgIxyEo,02/09/2020 23:26,1,4,3,21,20,3,4,4,3,11,18,29,12,14,26,3,3,4,4,37,,Prefer not to say,Prefer not to say,0,TS5,6,acontrol,control,0,,,,,,,,,,,,,,,,,,,,,,,,,,5,4.781174578,54.562969,-1.2720735
26118240,1662,R_re9Ab5NMPAVx2nf,22/08/2020 11:45,633,R_5tgvBDuZDVrFyXn,04/09/2020 04:40,1,6,7,30,30,8,6,8,9,24,28,52,22,28,50,3,3,8,8,50,,Female,White,1,GL56,5,combinedbutterfly,combined,2,5,5,5,5,5,4,2,3,1,I did not know about the butterfly app - so I am delighted to keep using that,,,1,,,,sadly the weather was awful so I wanted a button to click on to report that I could not go and watch butterflies in a storm!,1,,,,,,,,7,6.8921875,51.992234,-1.7004826
29293,889,R_30l8Npw0IYeH0nh,28/07/2020 01:28,0,R_z1DmpvSZQenH1HH,05/08/2020 09:39,1,6,6,30,29,6,7,7,7,18,23,41,17,21,38,2,2,7,7,46,,Female,White,1,NP4,3,noticingnature,noticingnature,2,4,4,4,4,3,1,2,5,1,Being prompted to notice nature and the additional things I spottef,1,,,,,,Nothing,,,,,,,1,,4,4.58220926,51.740388,-3.0443511
